{
  "$schema": "https://json-schema.org/draft/2020-12/schema",
  "$id": "urn:agent-mirror:report:am-0.2",
  "type": "object",
  "additionalProperties": false,
  "properties": {
    "schemaVersion": {
      "const": 1
    },
    "scoringVersion": {
      "const": "am-0.2"
    },
    "kind": {
      "enum": [
        "local-assessment",
        "synthetic"
      ]
    },
    "ratings": {
      "type": "array",
      "items": {
        "type": "array",
        "items": {
          "type": "object",
          "additionalProperties": false,
          "properties": {
            "value": {
              "anyOf": [
                {
                  "type": "integer",
                  "minimum": 0,
                  "maximum": 4
                },
                {
                  "type": "null"
                }
              ]
            },
            "confidence": {
              "type": "number",
              "minimum": 0,
              "maximum": 1
            },
            "evidence": {
              "type": "array",
              "items": {
                "type": "string",
                "pattern": "^[A-Za-z0-9][A-Za-z0-9._:@|/#=-]{0,255}$"
              }
            },
            "basis": {
              "enum": [
                "declared",
                "observed",
                "self-report",
                "unknown"
              ]
            }
          },
          "required": [
            "value",
            "confidence",
            "evidence",
            "basis"
          ]
        },
        "minItems": 4,
        "maxItems": 4
      },
      "minItems": 6,
      "maxItems": 6
    },
    "evidence": {
      "type": "array",
      "items": {
        "type": "object",
        "additionalProperties": false,
        "properties": {
          "id": {
            "type": "string",
            "pattern": "^[A-Za-z0-9][A-Za-z0-9._:@|/#=-]{0,255}$"
          },
          "source": {
            "enum": [
              "project-structure",
              "agent-structure",
              "workflow-record"
            ]
          },
          "fact": {
            "type": "string",
            "maxLength": 160
          },
          "strength": {
            "enum": [
              "structure",
              "declaration",
              "observation"
            ]
          }
        },
        "required": [
          "id",
          "source",
          "fact",
          "strength"
        ]
      }
    },
    "summary": {
      "type": "object",
      "additionalProperties": false,
      "properties": {
        "dimensions": {
          "type": "array",
          "items": {
            "anyOf": [
              {
                "type": "number",
                "minimum": 0,
                "maximum": 100
              },
              {
                "type": "null"
              }
            ]
          },
          "minItems": 6,
          "maxItems": 6
        },
        "total": {
          "anyOf": [
            {
              "type": "number",
              "minimum": 0,
              "maximum": 100
            },
            {
              "type": "null"
            }
          ]
        },
        "coverage": {
          "type": "number",
          "minimum": 0,
          "maximum": 1
        },
        "confidence": {
          "enum": [
            "low",
            "medium",
            "high",
            "unknown"
          ]
        },
        "interval": {
          "anyOf": [
            {
              "type": "array",
              "items": {
                "type": "number",
                "minimum": 0,
                "maximum": 100
              },
              "minItems": 2,
              "maxItems": 2
            },
            {
              "type": "null"
            }
          ]
        }
      },
      "required": [
        "dimensions",
        "total",
        "coverage",
        "confidence",
        "interval"
      ]
    },
    "assessmentGate": {
      "type": "object",
      "additionalProperties": false,
      "properties": {
        "status": {
          "enum": [
            "ready",
            "blocked"
          ]
        },
        "reviewComplete": {
          "type": "boolean"
        },
        "familiesFinalized": {
          "type": "boolean"
        },
        "counterexamplesReviewed": {
          "type": "boolean"
        }
      },
      "required": [
        "status",
        "reviewComplete",
        "familiesFinalized",
        "counterexamplesReviewed"
      ]
    }
  },
  "required": [
    "schemaVersion",
    "scoringVersion",
    "kind",
    "ratings",
    "evidence",
    "summary"
  ]
}
